=== START OF INFORMATION SECTION ===
Model Family:     Phison Driven SSDs                                # smartctl -a /dev/sda | grep 'Model Family' | cut -f2 -d ":"
Device Model:     KINGSTON SA400S37120G                             # smartctl -a /dev/sda | grep 'Device Model' | cut -f2 -d ":"
Serial Number:    50026B7782388DCB                                  # smartctl -a /dev/sda | grep 'Serial Number' | cut -f2 -d ":"
LU WWN Device Id: 5 0026b7 782388dcb                                # smartctl -a /dev/sda | grep 'LU WWN Device Id' | cut -f2 -d ":"
Firmware Version: SBFKB1E1                                          # smartctl -a /dev/sda | grep 'Firmware Version' | cut -f2 -d ":"
User Capacity:    120,034,123,776 bytes [120 GB]                    # smartctl -a /dev/sda | grep 'User Capacity' | cut -f2 -d ":" | cut -f2 -d "[" | cut -f1 -d "]"
Sector Size:      512 bytes logical/physical                        # smartctl -a /dev/sda | grep 'Sector Size' | cut -f2 -d ":"
Rotation Rate:    Solid State Device                                # smartctl -a /dev/sda | grep 'Rotation Rate' | cut -f2 -d ":"
Device is:        In smartctl database [for details use: -P show]   # smartctl -a /dev/sda | grep 'Device is' | cut -f2 -d ":" | cut -f1 -d "["
ATA Version is:   ACS-3 T13/2161-D revision 4                       # smartctl -a /dev/sda | grep 'ATA Version is' | cut -f2 -d ":" | awk 'NR==1'
SATA Version is:  SATA 3.2, 6.0 Gb/s (current: 3.0 Gb/s)            # smartctl -a /dev/sda | grep 'SATA Version is' | cut -f2 -d ":"
Local Time is:    Wed Oct  7 10:44:35 2020 -03
SMART support is: Available - device has SMART capability.
SMART support is: Enabled                                           # smartctl -a /dev/sda | grep 'SMART support is' | cut -f2 -d ":" | awk 'NR==2'

=== START OF READ SMART DATA SECTION ===
SMART overall-health self-assessment test result: PASSED            # smartctl -a /dev/sda | grep 'SMART overall-health self-assessment test result' | cut -f2 -d ":"

ID# ATTRIBUTE_NAME          FLAG     VALUE WORST THRESH TYPE      UPDATED  WHEN_FAILED RAW_VALUE                        # smartctl -a /dev/sda | grep -i -n -w "ATTRIBUTE_NAME" | cut -f1 -d ":" # DEVOLVE NUMERO DA LINHA: 53
  1 Raw_Read_Error_Rate     0x0032   100   100   000    Old_age   Always       -       0                                # smartctl -a /dev/sda | head -54 | tail -1 | awk '{print $2}' # DEVOLVE NOME DO ELEMENTE
  9 Power_On_Hours          0x0032   100   100   000    Old_age   Always       -       470                              # ID              # smartctl -a /dev/sda | grep 'Raw_Read_Error_Rate' | awk '{print $1}'
 12 Power_Cycle_Count       0x0032   100   100   000    Old_age   Always       -       50                               # ATTRIBUTE_NAME  # smartctl -a /dev/sda | grep 'Raw_Read_Error_Rate' | awk '{print $2}'
148 Unknown_Attribute       0x0000   255   255   000    Old_age   Offline      -       0                                # FLAG            # smartctl -a /dev/sda | grep 'Raw_Read_Error_Rate' | awk '{print $3}'
149 Unknown_Attribute       0x0000   255   255   000    Old_age   Offline      -       0                                # VALUE           # smartctl -a /dev/sda | grep 'Raw_Read_Error_Rate' | awk '{print $4}'
167 Write_Protect_Mode      0x0000   100   100   000    Old_age   Offline      -       0                                # WORST           # smartctl -a /dev/sda | grep 'Raw_Read_Error_Rate' | awk '{print $5}'
168 SATA_Phy_Error_Count    0x0012   100   100   000    Old_age   Always       -       0                                # THRESH          # smartctl -a /dev/sda | grep 'Raw_Read_Error_Rate' | awk '{print $6}'
169 Bad_Block_Rate          0x0000   100   100   000    Old_age   Offline      -       14                               # TYPE            # smartctl -a /dev/sda | grep 'Raw_Read_Error_Rate' | awk '{print $7}'
170 Bad_Blk_Ct_Erl/Lat      0x0000   100   100   010    Old_age   Offline      -       0/10                             # UPDATED         # smartctl -a /dev/sda | grep 'Raw_Read_Error_Rate' | awk '{print $8}'
172 Erase_Fail_Count        0x0032   100   100   000    Old_age   Always       -       0                                # WHEN_FAILED     # smartctl -a /dev/sda | grep 'Raw_Read_Error_Rate' | awk '{print $9}'
173 MaxAvgErase_Ct          0x0000   100   100   000    Old_age   Offline      -       5 (Average 3)                    # RAW_VALUE       # smartctl -a /dev/sda | grep 'Raw_Read_Error_Rate' | awk '{print $10}'
181 Program_Fail_Count      0x0032   100   100   000    Old_age   Always       -       0
182 Erase_Fail_Count        0x0000   255   255   000    Old_age   Offline      -       0
187 Reported_Uncorrect      0x0032   100   100   000    Old_age   Always       -       0
192 Unsafe_Shutdown_Count   0x0012   100   100   000    Old_age   Always       -       49
194 Temperature_Celsius     0x0022   072   067   000    Old_age   Always       -       28 (Min/Max 20/33)
196 Reallocated_Event_Count 0x0000   100   100   000    Old_age   Offline      -       0
199 SATA_CRC_Error_Count    0x0032   100   100   000    Old_age   Always       -       0
218 CRC_Error_Count         0x0000   100   100   000    Old_age   Offline      -       0
231 SSD_Life_Left           0x0013   100   100   000    Pre-fail  Always       -       99
233 Flash_Writes_GiB        0x0013   100   100   000    Pre-fail  Always       -       179
241 Lifetime_Writes_GiB     0x0012   100   100   000    Old_age   Always       -       110
242 Lifetime_Reads_GiB      0x0012   100   100   000    Old_age   Always       -       301
244 Average_Erase_Count     0x0000   100   100   000    Old_age   Offline      -       3
245 Max_Erase_Count         0x0000   100   100   000    Old_age   Offline      -       5
246 Total_Erase_Count       0x0000   100   100   000    Old_age   Offline      -       12456
